{
  "candidate_id": "c3",
  "tier": "1",
  "checks": [
    {
      "dimension": "printability",
      "tool": "printability.validate_mesh",
      "value": {
        "watertight": true,
        "winding_consistent": true,
        "is_volume": true,
        "manifold3d_status": "Error.NoError",
        "body_count": 1
      },
      "pass": true,
      "status": "computed",
      "source": "trimesh 边-面计数 + manifold3d Mesh.merge 往返 status(双引擎,bench_printability.py 本机验证)",
      "caveats": [],
      "threshold": {
        "watertight": true,
        "manifold3d_status": "NoError"
      }
    },
    {
      "dimension": "printability",
      "tool": "printability.measure_min_feature",
      "value": {
        "min_mm": 0.7931557353837527,
        "p5_mm": 0.7931557880267691,
        "median_mm": 0.7931559159382872,
        "n_valid_samples": 400
      },
      "pass": false,
      "status": "computed",
      "source": "阈值: EOS PA12 (PA 2200) design guidelines, min wall/feature ~0.8 mm;方法: embree 射线测厚(bench 验证 BCC d=1.0 误差 0.1-0.5%)",
      "caveats": [
        "判据用 p5(射线采样对尖角/相贯线的极小值噪声鲁棒);min_mm 一并报告"
      ],
      "threshold": 0.8
    },
    {
      "dimension": "printability",
      "tool": "printability.check_overhangs",
      "value": {
        "overhang_area_fraction": 0.0
      },
      "pass": true,
      "status": "computed",
      "source": "粉末床聚合物无需支撑,悬垂检查不适用(skip)",
      "caveats": [
        "粉末床聚合物自支撑,悬垂检查跳过"
      ],
      "threshold": null
    },
    {
      "dimension": "printability",
      "tool": "printability.check_powder_escape",
      "value": {
        "trapped_void_mm3": 0.0,
        "voxel_pitch_mm": 0.25,
        "tolerance_mm3": 0.125,
        "odd_parity_rays": 0
      },
      "pass": true,
      "status": "computed",
      "source": "困粉: embree 列射线奇偶填充 + scipy flood-fill(bench_printability3.py 正负对照验证)",
      "caveats": [
        "体素量化容差 ±0.125 mm³(pitch=0.25);Evaluator 不得据此误杀边界候选"
      ],
      "threshold": 0.125
    },
    {
      "dimension": "density",
      "tool": "rel_density.mesh(manifold3d)",
      "value": 0.21036,
      "pass": true,
      "status": "computed",
      "source": "manifold3d watertight 体积 / 胞体积"
    },
    {
      "dimension": "mechanics",
      "tool": "gibson_ashby.estimate",
      "value": {
        "E_MPa": 75.22912353291555,
        "sigma_y_MPa": 1.3025265335228555,
        "model": "Gibson-Ashby (bending)"
      },
      "pass": null,
      "status": "estimate",
      "source": "Gibson & Ashby, Cellular Solids, 2nd ed., Cambridge UP, 1997 (bending: E*~rho^2, sigma_y*~0.3 rho^1.5)",
      "caveats": [
        "解析筛数值仅 screening only,不得通过 margin 门;OOD 拓扑只有全 FEA(Tier-D)可授予设计参考级",
        "聚合物 AM as-built 偏差幅度无文献来源,内部工程估计 ±10-30%(source_type=inference)"
      ],
      "threshold": null,
      "source_type": "internal_computed"
    },
    {
      "dimension": "topology_tendency",
      "tool": "maxwell_check",
      "value": {
        "maxwell_M": -14,
        "tendency": "bending-leaning"
      },
      "pass": true,
      "status": "computed",
      "source": "Maxwell 1864; Deshpande, Ashby & Fleck, Acta Mater. 49(6):1035-1040, 2001, DOI 10.1016/S1359-6454(00)00379-7",
      "caveats": [
        "Maxwell 数是必要非充分判据,只输出倾向;FCCZ/FBCCZ 类含定向strut 的拓扑是已知反例(Nasim & Galvanetto 2021, MJF PA12)。最终力学行为以工具证据(beam-FEM/FEA/实验)为准"
      ],
      "threshold": null
    },
    {
      "dimension": "mechanics",
      "tool": "retriever.nearest_by_density+comp_EA",
      "value": 216.634419,
      "pass": true,
      "status": "computed",
      "source": "internal FEA feature extraction: data_package/extracted_features_smoothed.csv (mtime 2026-01-21), derived from the same Abaqus pipeline",
      "source_type": "internal_fea",
      "margin_eligible": true,
      "applicability_distance": 0.0002276050599235857,
      "caveats": [
        "库内最近邻实测值;密度距离 0.0002"
      ]
    },
    {
      "dimension": "material",
      "tool": "material_props[PA12_MJF]",
      "value": 1700,
      "pass": true,
      "status": "computed",
      "source": "HP 3D HR PA12 datasheet, tensile modulus ~1700-1800 MPa",
      "source_type": "vendor"
    },
    {
      "dimension": "size_effect",
      "tool": "scaling.n_cells_advisory",
      "value": 4,
      "pass": null,
      "status": "computed",
      "source": "Onck/Andrews 2001 边界层机制(atlas/references);修正引擎接线归 P2",
      "caveats": []
    },
    {
      "dimension": "mechanics",
      "tool": "dynamic_shear_features",
      "value": {
        "n_dynamic_curves": 88,
        "dyna_peak": 2.8755,
        "dyna_stiffness": 43.3204,
        "dyna_yield": 2.8755,
        "shear_peak": 2.3885
      },
      "pass": null,
      "status": "computed",
      "source": "P2-5 原始曲线自提(atlas/data/extract_dynamic.py):dyna_stiffness=5% 应变割线(含惯性瞬态,非弹性模量,Phase 3 滤波后重提);dyna_yield=首个局部峰应力(落锤动态屈服代理);peak 取前 30% 应变窗;剪切面积=名义 25mm²(约定);曲线源=内部 Abaqus 显式管线(步长 ~0.1mm)",
      "caveats": [
        "P2-5 自提特征(近邻库内值,OOD 不提供);动态/剪切验证成熟度属 Phase 3,数值供参考不入 margin"
      ]
    }
  ],
  "verdict": "FAIL",
  "verdict_reasons": [
    "硬性检查未过: printability/printability.measure_min_feature"
  ],
  "downgrades": [],
  "confidence_level": "screening",
  "n_cells": 4,
  "regeneration_round": 0
}