{
  "candidate_id": "c7",
  "tier": "2",
  "checks": [
    {
      "dimension": "printability",
      "tool": "printability.validate_mesh",
      "value": {
        "watertight": true,
        "winding_consistent": true,
        "is_volume": true,
        "manifold3d_status": "Error.NoError",
        "body_count": 1
      },
      "pass": true,
      "status": "computed",
      "source": "trimesh 边-面计数 + manifold3d Mesh.merge 往返 status(双引擎,bench_printability.py 本机验证)",
      "caveats": [],
      "threshold": {
        "watertight": true,
        "manifold3d_status": "NoError"
      }
    },
    {
      "dimension": "printability",
      "tool": "printability.measure_min_feature",
      "value": {
        "min_mm": 0.8923002704874033,
        "p5_mm": 0.8923003711259373,
        "median_mm": 0.8925062344737189,
        "n_valid_samples": 400
      },
      "pass": true,
      "status": "computed",
      "source": "阈值: EOS PA12 (PA 2200) design guidelines, min wall/feature ~0.8 mm;方法: embree 射线测厚(bench 验证 BCC d=1.0 误差 0.1-0.5%)",
      "caveats": [
        "判据用 p5(射线采样对尖角/相贯线的极小值噪声鲁棒);min_mm 一并报告"
      ],
      "threshold": 0.8
    },
    {
      "dimension": "printability",
      "tool": "printability.check_overhangs",
      "value": {
        "overhang_area_fraction": 0.0
      },
      "pass": true,
      "status": "computed",
      "source": "粉末床聚合物无需支撑,悬垂检查不适用(skip)",
      "caveats": [
        "粉末床聚合物自支撑,悬垂检查跳过"
      ],
      "threshold": null
    },
    {
      "dimension": "printability",
      "tool": "printability.check_powder_escape",
      "value": {
        "trapped_void_mm3": 0.0,
        "voxel_pitch_mm": 0.25,
        "tolerance_mm3": 0.125,
        "odd_parity_rays": 0
      },
      "pass": true,
      "status": "computed",
      "source": "困粉: embree 列射线奇偶填充 + scipy flood-fill(bench_printability3.py 正负对照验证)",
      "caveats": [
        "体素量化容差 ±0.125 mm³(pitch=0.25);Evaluator 不得据此误杀边界候选"
      ],
      "threshold": 0.125
    },
    {
      "dimension": "density",
      "tool": "rel_density.mesh(manifold3d)",
      "value": 0.15336,
      "pass": true,
      "status": "computed",
      "source": "manifold3d watertight 体积 / 胞体积"
    },
    {
      "dimension": "material",
      "tool": "material_props[PA12_MJF]",
      "value": 1700,
      "pass": true,
      "status": "computed",
      "source": "HP 3D HR PA12 datasheet, tensile modulus ~1700-1800 MPa",
      "source_type": "vendor"
    },
    {
      "dimension": "size_effect",
      "tool": "scaling.n_cells_advisory",
      "value": 4,
      "pass": null,
      "status": "computed",
      "source": "Onck/Andrews 2001 边界层机制(atlas/references);修正引擎接线归 P2",
      "caveats": []
    }
  ],
  "verdict": "FAIL",
  "verdict_reasons": [
    "R2: 无可用 margin 证据(pred/design 缺失)"
  ],
  "downgrades": [],
  "confidence_level": "screening",
  "n_cells": 4,
  "regeneration_round": 0
}